{
  "aggregate": {
    "duplicate_noise": {
      "cases_with_duplication": 0,
      "duplicate_rate": "0",
      "total_duplicate_clusters": 0,
      "total_produced": 3,
      "total_redundant_findings": 0
    },
    "metrics": {
      "cases_with_false_negatives": 0,
      "cases_with_false_positives": 0,
      "errored_cases": 0,
      "total_false_negatives": 0,
      "total_false_positives": 0,
      "total_near_misses": 0
    },
    "severity": {
      "cases_with_severity_mismatch": 0,
      "exact_rate": "1",
      "total_matched": 3,
      "total_over_severity": 0,
      "total_severity_exact": 3,
      "total_under_severity": 0
    }
  },
  "baseline": {
    "comparable_case_ids": [
      "correctness-off-by-one-pagination",
      "no-op-comment-and-rename",
      "quality-duplicated-branch-logic",
      "security-command-injection"
    ],
    "incomparable_cases": [],
    "record_sha256": "5254f837cd91e87d9aec305a34e7245aad48698d1d9b00957238c1b4db39d82c",
    "run_id": "sentinel-20260924T220515Z-bf01aff11010",
    "state": "compared"
  },
  "cases": [
    {
      "duplicate_noise": {
        "cluster_members": [],
        "clusters": 1,
        "duplicate_clusters": 0,
        "duplicate_rate": "0",
        "produced": 1,
        "redundant_findings": 0
      },
      "duration_s": 75.562,
      "fixture_digest": "f9a3d58d4032fa5a77ff05362f499587013b48c8cd463859a7bc845f611df5d2",
      "id": "correctness-off-by-one-pagination",
      "metrics": {
        "absorbed_extra_match": 0,
        "false_negatives": 0,
        "false_positives": 0,
        "findings_completeness": "exhaustive",
        "incorrect_indices": [],
        "missed_keys": [],
        "near_misses": 0,
        "tolerated_unexpected": 0
      },
      "severity": {
        "exact_rate": "1",
        "matched": 1,
        "mismatches": [],
        "over_severity": 0,
        "severity_exact": 1,
        "under_severity": 0
      },
      "status": "executed"
    },
    {
      "duplicate_noise": {
        "cluster_members": [],
        "clusters": 0,
        "duplicate_clusters": 0,
        "duplicate_rate": null,
        "produced": 0,
        "redundant_findings": 0
      },
      "duration_s": 75.562,
      "fixture_digest": "30e77dbb7cf37a63cfc707970f4fcdbb6299c80740baf64a836d1ac1e96bc012",
      "id": "no-op-comment-and-rename",
      "metrics": {
        "absorbed_extra_match": 0,
        "false_negatives": 0,
        "false_positives": 0,
        "findings_completeness": "exhaustive",
        "incorrect_indices": [],
        "missed_keys": [],
        "near_misses": 0,
        "tolerated_unexpected": 0
      },
      "severity": {
        "exact_rate": null,
        "matched": 0,
        "mismatches": [],
        "over_severity": 0,
        "severity_exact": 0,
        "under_severity": 0
      },
      "status": "executed"
    },
    {
      "duplicate_noise": {
        "cluster_members": [],
        "clusters": 1,
        "duplicate_clusters": 0,
        "duplicate_rate": "0",
        "produced": 1,
        "redundant_findings": 0
      },
      "duration_s": 75.562,
      "fixture_digest": "08c162bf00c415a22a70ab358f9a729a5f0a1e61e1e05d4e62bd63f2896c1319",
      "id": "quality-duplicated-branch-logic",
      "metrics": {
        "absorbed_extra_match": 0,
        "false_negatives": 0,
        "false_positives": 0,
        "findings_completeness": "exhaustive",
        "incorrect_indices": [],
        "missed_keys": [],
        "near_misses": 0,
        "tolerated_unexpected": 0
      },
      "severity": {
        "exact_rate": "1",
        "matched": 1,
        "mismatches": [],
        "over_severity": 0,
        "severity_exact": 1,
        "under_severity": 0
      },
      "status": "executed"
    },
    {
      "duplicate_noise": {
        "cluster_members": [],
        "clusters": 1,
        "duplicate_clusters": 0,
        "duplicate_rate": "0",
        "produced": 1,
        "redundant_findings": 0
      },
      "duration_s": 75.562,
      "fixture_digest": "5a2dc39cab5c008eac70ebe91ee336957248287e001058a68d9d8b989eee0a82",
      "id": "security-command-injection",
      "metrics": {
        "absorbed_extra_match": 0,
        "false_negatives": 0,
        "false_positives": 0,
        "findings_completeness": "exhaustive",
        "incorrect_indices": [],
        "missed_keys": [],
        "near_misses": 0,
        "tolerated_unexpected": 0
      },
      "severity": {
        "exact_rate": "1",
        "matched": 1,
        "mismatches": [],
        "over_severity": 0,
        "severity_exact": 1,
        "under_severity": 0
      },
      "status": "executed"
    }
  ],
  "content_sha256": "55f4668fe37244768cef60d68ac65fea7f70b3bde725b03adcb7a768a25ae9bb",
  "corpus": {
    "case_count": 4,
    "corpus_id": "39fa0e1a40b1acbe94f40d84d90adec2c79a9ff1bc4cb068b92f6f9fb8ab2b97",
    "membership_digest": "96f4622d88d141011f9569478821a9e92a8798f8f7b5774adc7080fecd6d7499"
  },
  "drift": {
    "attribution": "runtime-changed",
    "confirmation": {
      "max_cases": 10,
      "reruns": 2,
      "threshold": 2
    },
    "confirmed": [],
    "evaluated_scope": [
      "correctness-off-by-one-pagination",
      "no-op-comment-and-rename",
      "quality-duplicated-branch-logic",
      "security-command-injection"
    ],
    "evidence": {},
    "observations": [],
    "outcome": {
      "reason": null,
      "status": "none"
    },
    "systemic": false,
    "unconfirmed": []
  },
  "execution": {
    "confirmation_reruns": 0,
    "duration_s": 303.184,
    "session_ref": null,
    "warnings": []
  },
  "finished_at": "2026-09-27T22:11:30Z",
  "lane": "sentinel",
  "mode": "sentinel",
  "provenance": {
    "entrypoint_version": "run_benchmark_routine.py@0366b0790dd0",
    "ref": "refs/heads/main",
    "repo": "amirbena/code-review-skill",
    "repo_sha": "0366b0790dd09f3033d4c187151d01a10feff254",
    "spec_sha256": "dc3bebf42aea7b5ef0bfd287b6fa27055383587e0f4d6a99be5acd0ce3785f76"
  },
  "raw": {
    "bundle_sha256": "6fe6dc9b575675609f5228d5e1b20df250852fa9e6407bb2d116e7b6a6ad315c",
    "location": "claude/benchmark-result-sentinel-20260927T220627Z-0366b0790dd0:raw-bundle.json"
  },
  "reproduction": {
    "case_ids": [
      "correctness-off-by-one-pagination",
      "no-op-comment-and-rename",
      "quality-duplicated-branch-logic",
      "security-command-injection"
    ],
    "command": "python3 runtime_platform/benchmark/scripts/run_benchmark_routine.py --mode sentinel",
    "nondeterminism": "Model output is nondeterministic; a rerun may differ.",
    "python_version": "3.11.15"
  },
  "run_id": "sentinel-20260927T220627Z-0366b0790dd0",
  "runtime": {
    "adapter_id": "production-review-adapter@0366b0790dd0",
    "model_id": "claude-sonnet-5",
    "runtime_name": "claude",
    "runtime_version": "2.1.283 (Claude Code)"
  },
  "schema": "benchmark-result/v1",
  "sealed_at": "2026-09-27T22:11:30Z",
  "started_at": "2026-09-27T22:06:27Z",
  "trigger": "scheduled",
  "verification": {
    "overall_verified": true,
    "runs": [
      {
        "case_count": 4,
        "case_ids": [
          "correctness-off-by-one-pagination",
          "no-op-comment-and-rename",
          "quality-duplicated-branch-logic",
          "security-command-injection"
        ],
        "passed": true,
        "reason": "verified"
      }
    ]
  }
}
