{
  "aggregate": {
    "duplicate_noise": {
      "cases_with_duplication": 0,
      "duplicate_rate": "0",
      "total_duplicate_clusters": 0,
      "total_produced": 3,
      "total_redundant_findings": 0
    },
    "metrics": {
      "cases_with_false_negatives": 0,
      "cases_with_false_positives": 0,
      "errored_cases": 0,
      "total_false_negatives": 0,
      "total_false_positives": 0,
      "total_near_misses": 0
    },
    "severity": {
      "cases_with_severity_mismatch": 1,
      "exact_rate": "2/3",
      "total_matched": 3,
      "total_over_severity": 1,
      "total_severity_exact": 2,
      "total_under_severity": 0
    }
  },
  "baseline": {
    "comparable_case_ids": [
      "correctness-off-by-one-pagination",
      "no-op-comment-and-rename",
      "quality-duplicated-branch-logic",
      "security-command-injection"
    ],
    "incomparable_cases": [],
    "record_sha256": "5254f837cd91e87d9aec305a34e7245aad48698d1d9b00957238c1b4db39d82c",
    "run_id": "sentinel-20260924T220515Z-bf01aff11010",
    "state": "compared"
  },
  "cases": [
    {
      "duplicate_noise": {
        "cluster_members": [],
        "clusters": 1,
        "duplicate_clusters": 0,
        "duplicate_rate": "0",
        "produced": 1,
        "redundant_findings": 0
      },
      "duration_s": 18.921,
      "fixture_digest": "f9a3d58d4032fa5a77ff05362f499587013b48c8cd463859a7bc845f611df5d2",
      "id": "correctness-off-by-one-pagination",
      "metrics": {
        "absorbed_extra_match": 0,
        "false_negatives": 0,
        "false_positives": 0,
        "findings_completeness": "exhaustive",
        "incorrect_indices": [],
        "missed_keys": [],
        "near_misses": 0,
        "tolerated_unexpected": 0
      },
      "severity": {
        "exact_rate": "0",
        "matched": 1,
        "mismatches": [
          {
            "direction": "over",
            "expected": [
              "P1"
            ],
            "key": "page-end-off-by-one",
            "produced": "P0",
            "produced_index": 0
          }
        ],
        "over_severity": 1,
        "severity_exact": 0,
        "under_severity": 0
      },
      "status": "executed"
    },
    {
      "duplicate_noise": {
        "cluster_members": [],
        "clusters": 0,
        "duplicate_clusters": 0,
        "duplicate_rate": null,
        "produced": 0,
        "redundant_findings": 0
      },
      "duration_s": 18.921,
      "fixture_digest": "30e77dbb7cf37a63cfc707970f4fcdbb6299c80740baf64a836d1ac1e96bc012",
      "id": "no-op-comment-and-rename",
      "metrics": {
        "absorbed_extra_match": 0,
        "false_negatives": 0,
        "false_positives": 0,
        "findings_completeness": "exhaustive",
        "incorrect_indices": [],
        "missed_keys": [],
        "near_misses": 0,
        "tolerated_unexpected": 0
      },
      "severity": {
        "exact_rate": null,
        "matched": 0,
        "mismatches": [],
        "over_severity": 0,
        "severity_exact": 0,
        "under_severity": 0
      },
      "status": "executed"
    },
    {
      "duplicate_noise": {
        "cluster_members": [],
        "clusters": 1,
        "duplicate_clusters": 0,
        "duplicate_rate": "0",
        "produced": 1,
        "redundant_findings": 0
      },
      "duration_s": 18.921,
      "fixture_digest": "08c162bf00c415a22a70ab358f9a729a5f0a1e61e1e05d4e62bd63f2896c1319",
      "id": "quality-duplicated-branch-logic",
      "metrics": {
        "absorbed_extra_match": 0,
        "false_negatives": 0,
        "false_positives": 0,
        "findings_completeness": "exhaustive",
        "incorrect_indices": [],
        "missed_keys": [],
        "near_misses": 0,
        "tolerated_unexpected": 0
      },
      "severity": {
        "exact_rate": "1",
        "matched": 1,
        "mismatches": [],
        "over_severity": 0,
        "severity_exact": 1,
        "under_severity": 0
      },
      "status": "executed"
    },
    {
      "duplicate_noise": {
        "cluster_members": [],
        "clusters": 1,
        "duplicate_clusters": 0,
        "duplicate_rate": "0",
        "produced": 1,
        "redundant_findings": 0
      },
      "duration_s": 18.921,
      "fixture_digest": "5a2dc39cab5c008eac70ebe91ee336957248287e001058a68d9d8b989eee0a82",
      "id": "security-command-injection",
      "metrics": {
        "absorbed_extra_match": 0,
        "false_negatives": 0,
        "false_positives": 0,
        "findings_completeness": "exhaustive",
        "incorrect_indices": [],
        "missed_keys": [],
        "near_misses": 0,
        "tolerated_unexpected": 0
      },
      "severity": {
        "exact_rate": "1",
        "matched": 1,
        "mismatches": [],
        "over_severity": 0,
        "severity_exact": 1,
        "under_severity": 0
      },
      "status": "executed"
    }
  ],
  "content_sha256": "7ed482685ba1dace18f1bf84a9a50760c74acc345b2969aa4f064a02b3330c42",
  "corpus": {
    "case_count": 4,
    "corpus_id": "39fa0e1a40b1acbe94f40d84d90adec2c79a9ff1bc4cb068b92f6f9fb8ab2b97",
    "membership_digest": "96f4622d88d141011f9569478821a9e92a8798f8f7b5774adc7080fecd6d7499"
  },
  "drift": {
    "attribution": "runtime-changed",
    "confirmation": {
      "max_cases": 10,
      "reruns": 2,
      "threshold": 2
    },
    "confirmed": [],
    "evaluated_scope": [
      "correctness-off-by-one-pagination",
      "no-op-comment-and-rename",
      "quality-duplicated-branch-logic",
      "security-command-injection"
    ],
    "evidence": {},
    "observations": [
      {
        "case_id": "correctness-off-by-one-pagination",
        "detail": "severity exact-match rate dropped from 1 to 0",
        "drift_type": "severity-accuracy-drop",
        "expected_finding_key": "-",
        "fingerprint": "95204433e8ae9042cc91906618576f519611ec4999789d2168c5c39dcb41509e"
      }
    ],
    "outcome": {
      "reason": null,
      "status": "none"
    },
    "systemic": false,
    "unconfirmed": [
      {
        "case_id": "correctness-off-by-one-pagination",
        "detail": "severity exact-match rate dropped from 1 to 0",
        "drift_type": "severity-accuracy-drop",
        "expected_finding_key": "-",
        "fingerprint": "95204433e8ae9042cc91906618576f519611ec4999789d2168c5c39dcb41509e",
        "reason": "not-reproduced"
      }
    ]
  },
  "execution": {
    "confirmation_reruns": 2,
    "duration_s": 123.563,
    "session_ref": null,
    "warnings": []
  },
  "finished_at": "2026-10-11T22:06:32Z",
  "lane": "sentinel",
  "mode": "sentinel",
  "provenance": {
    "entrypoint_version": "run_benchmark_routine.py@3d2b6b8eda40",
    "ref": "refs/heads/main",
    "repo": "amirbena/code-review-skill",
    "repo_sha": "3d2b6b8eda40a898ec418a89ae056cbe68ccf13e",
    "spec_sha256": "161282df14e325727744418a2902fa1a67089894233a34fd2e986f7e4bf5e137"
  },
  "raw": {
    "bundle_sha256": "f29d55414fad7351c15e698ae3afeee7a91f98963bdf38dc7b97413b983155b3",
    "location": "claude/benchmark-result-sentinel-20261011T220428Z-3d2b6b8eda40:raw-bundle.json"
  },
  "reproduction": {
    "case_ids": [
      "correctness-off-by-one-pagination",
      "no-op-comment-and-rename",
      "quality-duplicated-branch-logic",
      "security-command-injection"
    ],
    "command": "python3 runtime_platform/benchmark/scripts/run_benchmark_routine.py --mode sentinel",
    "nondeterminism": "Model output is nondeterministic; a rerun may differ.",
    "python_version": "3.11.17"
  },
  "run_id": "sentinel-20261011T220428Z-3d2b6b8eda40",
  "runtime": {
    "adapter_id": "production-review-adapter@3d2b6b8eda40",
    "model_id": "claude-sonnet-5",
    "runtime_name": "claude",
    "runtime_version": "2.1.296 (Claude Code)"
  },
  "schema": "benchmark-result/v1",
  "sealed_at": "2026-10-11T22:06:32Z",
  "started_at": "2026-10-11T22:04:28Z",
  "trigger": "scheduled",
  "verification": {
    "overall_verified": true,
    "runs": [
      {
        "case_count": 4,
        "case_ids": [
          "correctness-off-by-one-pagination",
          "no-op-comment-and-rename",
          "quality-duplicated-branch-logic",
          "security-command-injection"
        ],
        "passed": true,
        "reason": "verified"
      }
    ]
  }
}
