{
  "aggregate": {
    "duplicate_noise": {
      "cases_with_duplication": 0,
      "duplicate_rate": "0",
      "total_duplicate_clusters": 0,
      "total_produced": 3,
      "total_redundant_findings": 0
    },
    "metrics": {
      "cases_with_false_negatives": 0,
      "cases_with_false_positives": 0,
      "errored_cases": 0,
      "total_false_negatives": 0,
      "total_false_positives": 0,
      "total_near_misses": 0
    },
    "severity": {
      "cases_with_severity_mismatch": 1,
      "exact_rate": "2/3",
      "total_matched": 3,
      "total_over_severity": 1,
      "total_severity_exact": 2,
      "total_under_severity": 0
    }
  },
  "baseline": {
    "comparable_case_ids": [
      "correctness-off-by-one-pagination",
      "no-op-comment-and-rename",
      "quality-duplicated-branch-logic",
      "security-command-injection"
    ],
    "incomparable_cases": [],
    "record_sha256": "5254f837cd91e87d9aec305a34e7245aad48698d1d9b00957238c1b4db39d82c",
    "run_id": "sentinel-20260924T220515Z-bf01aff11010",
    "state": "compared"
  },
  "cases": [
    {
      "duplicate_noise": {
        "cluster_members": [],
        "clusters": 1,
        "duplicate_clusters": 0,
        "duplicate_rate": "0",
        "produced": 1,
        "redundant_findings": 0
      },
      "duration_s": 18.044,
      "fixture_digest": "f9a3d58d4032fa5a77ff05362f499587013b48c8cd463859a7bc845f611df5d2",
      "id": "correctness-off-by-one-pagination",
      "metrics": {
        "absorbed_extra_match": 0,
        "false_negatives": 0,
        "false_positives": 0,
        "findings_completeness": "exhaustive",
        "incorrect_indices": [],
        "missed_keys": [],
        "near_misses": 0,
        "tolerated_unexpected": 0
      },
      "severity": {
        "exact_rate": "0",
        "matched": 1,
        "mismatches": [
          {
            "direction": "over",
            "expected": [
              "P1"
            ],
            "key": "page-end-off-by-one",
            "produced": "P0",
            "produced_index": 0
          }
        ],
        "over_severity": 1,
        "severity_exact": 0,
        "under_severity": 0
      },
      "status": "executed"
    },
    {
      "duplicate_noise": {
        "cluster_members": [],
        "clusters": 0,
        "duplicate_clusters": 0,
        "duplicate_rate": null,
        "produced": 0,
        "redundant_findings": 0
      },
      "duration_s": 18.044,
      "fixture_digest": "30e77dbb7cf37a63cfc707970f4fcdbb6299c80740baf64a836d1ac1e96bc012",
      "id": "no-op-comment-and-rename",
      "metrics": {
        "absorbed_extra_match": 0,
        "false_negatives": 0,
        "false_positives": 0,
        "findings_completeness": "exhaustive",
        "incorrect_indices": [],
        "missed_keys": [],
        "near_misses": 0,
        "tolerated_unexpected": 0
      },
      "severity": {
        "exact_rate": null,
        "matched": 0,
        "mismatches": [],
        "over_severity": 0,
        "severity_exact": 0,
        "under_severity": 0
      },
      "status": "executed"
    },
    {
      "duplicate_noise": {
        "cluster_members": [],
        "clusters": 1,
        "duplicate_clusters": 0,
        "duplicate_rate": "0",
        "produced": 1,
        "redundant_findings": 0
      },
      "duration_s": 18.044,
      "fixture_digest": "08c162bf00c415a22a70ab358f9a729a5f0a1e61e1e05d4e62bd63f2896c1319",
      "id": "quality-duplicated-branch-logic",
      "metrics": {
        "absorbed_extra_match": 0,
        "false_negatives": 0,
        "false_positives": 0,
        "findings_completeness": "exhaustive",
        "incorrect_indices": [],
        "missed_keys": [],
        "near_misses": 0,
        "tolerated_unexpected": 0
      },
      "severity": {
        "exact_rate": "1",
        "matched": 1,
        "mismatches": [],
        "over_severity": 0,
        "severity_exact": 1,
        "under_severity": 0
      },
      "status": "executed"
    },
    {
      "duplicate_noise": {
        "cluster_members": [],
        "clusters": 1,
        "duplicate_clusters": 0,
        "duplicate_rate": "0",
        "produced": 1,
        "redundant_findings": 0
      },
      "duration_s": 18.044,
      "fixture_digest": "5a2dc39cab5c008eac70ebe91ee336957248287e001058a68d9d8b989eee0a82",
      "id": "security-command-injection",
      "metrics": {
        "absorbed_extra_match": 0,
        "false_negatives": 0,
        "false_positives": 0,
        "findings_completeness": "exhaustive",
        "incorrect_indices": [],
        "missed_keys": [],
        "near_misses": 0,
        "tolerated_unexpected": 0
      },
      "severity": {
        "exact_rate": "1",
        "matched": 1,
        "mismatches": [],
        "over_severity": 0,
        "severity_exact": 1,
        "under_severity": 0
      },
      "status": "executed"
    }
  ],
  "content_sha256": "6178af2f3f096dfea887d74aa1c124695421b9879809cc3616a6e5ba12622a94",
  "corpus": {
    "case_count": 4,
    "corpus_id": "39fa0e1a40b1acbe94f40d84d90adec2c79a9ff1bc4cb068b92f6f9fb8ab2b97",
    "membership_digest": "96f4622d88d141011f9569478821a9e92a8798f8f7b5774adc7080fecd6d7499"
  },
  "drift": {
    "attribution": "runtime-changed",
    "confirmation": {
      "max_cases": 10,
      "reruns": 2,
      "threshold": 2
    },
    "confirmed": [
      {
        "case_id": "correctness-off-by-one-pagination",
        "detail": "severity exact-match rate dropped from 1 to 0",
        "drift_type": "severity-accuracy-drop",
        "expected_finding_key": "-",
        "fingerprint": "95204433e8ae9042cc91906618576f519611ec4999789d2168c5c39dcb41509e"
      }
    ],
    "evaluated_scope": [
      "correctness-off-by-one-pagination",
      "no-op-comment-and-rename",
      "quality-duplicated-branch-logic",
      "security-command-injection"
    ],
    "evidence": {
      "correctness-off-by-one-pagination": "{\n  \"id\": \"correctness-off-by-one-pagination\",\n  \"input_kind\": \"patch\",\n  \"produced_findings\": [\n    {\n      \"claim\": \"Off-by-one in page slice returns `page_size + 1` items The diff changes the slice end from `offset + page_size` to `offset + page_size + 1`. Python slices exclude the end index, so the old bound was already correct. With `items=[0..9]`, `page_number=1`, `page_size=3`, the old code returned `[0,1,2]`. The new code returns `[0,1,2,3]`. Every full page returns an extra item. Item `n*page_size` shows up on both page `n` and page `n+1`, so consumers see duplicates and page sizes that break the contract. A final page of exactly `page_size` items also gets no extra item, so page lengths are inconsistent.\",\n      \"extra\": {\n        \"defect_kind\": \"off-by-one\",\n        \"evidence_quotes\": [\n          \"offset + page_size\",\n          \"offset + page_size + 1\",\n          \"items=[0..9]\",\n          \"page_number=1\",\n          \"page_size=3\",\n          \"[0,1,2]\",\n          \"[0,1,2,3]\"\n        ]\n      },\n      \"location\": {\n        \"line\": 4,\n        \"path\": \"app/pagination.py\"\n      },\n      \"severity\": \"P0\"\n    }\n  ],\n  \"status\": \"executed\"\n}"
    },
    "observations": [
      {
        "case_id": "correctness-off-by-one-pagination",
        "detail": "severity exact-match rate dropped from 1 to 0",
        "drift_type": "severity-accuracy-drop",
        "expected_finding_key": "-",
        "fingerprint": "95204433e8ae9042cc91906618576f519611ec4999789d2168c5c39dcb41509e"
      }
    ],
    "outcome": {
      "reason": null,
      "status": "drift"
    },
    "systemic": false,
    "unconfirmed": []
  },
  "execution": {
    "confirmation_reruns": 2,
    "duration_s": 118.082,
    "session_ref": null,
    "warnings": []
  },
  "finished_at": "2026-10-06T22:06:38Z",
  "lane": "sentinel",
  "mode": "sentinel",
  "provenance": {
    "entrypoint_version": "run_benchmark_routine.py@c1060db6db07",
    "ref": "refs/heads/claude/clever-thompson-q05e3z",
    "repo": "amirbena/code-review-skill",
    "repo_sha": "c1060db6db0726e5a67b1a81b4a284731cca8258",
    "spec_sha256": "dc3bebf42aea7b5ef0bfd287b6fa27055383587e0f4d6a99be5acd0ce3785f76"
  },
  "raw": {
    "bundle_sha256": "53c58ef0b4695ca7b1e0959646e64acd89c4508c312f508ec020b70eb341cc3f",
    "location": "claude/benchmark-result-sentinel-20261006T220440Z-c1060db6db07:raw-bundle.json"
  },
  "reproduction": {
    "case_ids": [
      "correctness-off-by-one-pagination",
      "no-op-comment-and-rename",
      "quality-duplicated-branch-logic",
      "security-command-injection"
    ],
    "command": "python3 runtime_platform/benchmark/scripts/run_benchmark_routine.py --mode sentinel",
    "nondeterminism": "Model output is nondeterministic; a rerun may differ.",
    "python_version": "3.11.17"
  },
  "run_id": "sentinel-20261006T220440Z-c1060db6db07",
  "runtime": {
    "adapter_id": "production-review-adapter@c1060db6db07",
    "model_id": "claude-sonnet-5",
    "runtime_name": "claude",
    "runtime_version": "2.1.292 (Claude Code)"
  },
  "schema": "benchmark-result/v1",
  "sealed_at": "2026-10-06T22:06:38Z",
  "started_at": "2026-10-06T22:04:40Z",
  "trigger": "scheduled",
  "verification": {
    "overall_verified": true,
    "runs": [
      {
        "case_count": 4,
        "case_ids": [
          "correctness-off-by-one-pagination",
          "no-op-comment-and-rename",
          "quality-duplicated-branch-logic",
          "security-command-injection"
        ],
        "passed": true,
        "reason": "verified"
      }
    ]
  }
}
